{
  "$schema": "https://json-schema.org/draft/2020-12/schema",
  "$id": "https://github.com/tt-a1i/archify/schemas/architecture.schema.json",
  "title": "Archify Architecture Diagram",
  "$defs": {
    "layout": {
      "type": "object",
      "additionalProperties": false,
      "required": [
        "mode"
      ],
      "properties": {
        "mode": {
          "enum": [
            "grid"
          ]
        },
        "origin": {
          "$ref": "common.schema.json#/$defs/point"
        },
        "cols": {
          "type": "integer",
          "minimum": 1,
          "maximum": 12
        },
        "gapX": {
          "type": "number",
          "minimum": 0
        },
        "gapY": {
          "type": "number",
          "minimum": 0
        },
        "cellW": {
          "type": "number",
          "minimum": 40
        },
        "cellH": {
          "type": "number",
          "minimum": 24
        }
      }
    },
    "componentCore": {
      "type": "object",
      "required": [
        "id",
        "type",
        "label"
      ],
      "properties": {
        "id": {
          "$ref": "common.schema.json#/$defs/id"
        },
        "type": {
          "$ref": "common.schema.json#/$defs/componentType"
        },
        "label": {
          "type": "string",
          "minLength": 1
        },
        "sublabel": {
          "type": "string"
        },
        "tag": {
          "type": "string"
        },
        "brand": {
          "$ref": "common.schema.json#/$defs/brandMark"
        },
        "sources": {
          "$ref": "common.schema.json#/$defs/sourceReferences"
        },
        "row": {
          "type": "integer",
          "minimum": 0
        },
        "col": {
          "type": "integer",
          "minimum": 0
        },
        "pos": {
          "$ref": "common.schema.json#/$defs/point"
        },
        "size": {
          "type": "array",
          "prefixItems": [
            {
              "type": "number",
              "exclusiveMinimum": 0
            },
            {
              "type": "number",
              "exclusiveMinimum": 0
            }
          ],
          "items": false,
          "minItems": 2,
          "maxItems": 2
        },
        "icon": {
          "$ref": "common.schema.json#/$defs/nodeIcon"
        }
      }
    },
    "localComponent": {
      "type": "object",
      "allOf": [
        {
          "$ref": "#/$defs/componentCore"
        }
      ],
      "unevaluatedProperties": false
    },
    "topLevelComponent": {
      "type": "object",
      "allOf": [
        {
          "$ref": "#/$defs/componentCore"
        },
        {
          "type": "object",
          "properties": {
            "subarchitecture": {
              "$ref": "#/$defs/subarchitecture"
            }
          }
        }
      ],
      "unevaluatedProperties": false
    },
    "boundary": {
      "type": "object",
      "additionalProperties": false,
      "required": [
        "kind",
        "label",
        "wraps"
      ],
      "properties": {
        "kind": {
          "enum": [
            "region",
            "security-group"
          ]
        },
        "label": {
          "type": "string",
          "minLength": 1
        },
        "wraps": {
          "type": "array",
          "minItems": 1,
          "items": {
            "$ref": "common.schema.json#/$defs/id"
          }
        },
        "pad": {
          "type": "number",
          "minimum": 0
        }
      }
    },
    "connection": {
      "type": "object",
      "additionalProperties": false,
      "required": [
        "from",
        "to"
      ],
      "properties": {
        "id": {
          "$ref": "common.schema.json#/$defs/id"
        },
        "from": {
          "$ref": "common.schema.json#/$defs/id"
        },
        "to": {
          "$ref": "common.schema.json#/$defs/id"
        },
        "label": {
          "type": "string"
        },
        "variant": {
          "$ref": "common.schema.json#/$defs/variant"
        },
        "fromSide": {
          "$ref": "common.schema.json#/$defs/side"
        },
        "toSide": {
          "$ref": "common.schema.json#/$defs/side"
        },
        "route": {
          "enum": [
            "auto",
            "straight",
            "orthogonal-h",
            "orthogonal-v"
          ]
        },
        "via": {
          "type": "array",
          "items": {
            "$ref": "common.schema.json#/$defs/point"
          }
        },
        "labelAt": {
          "$ref": "common.schema.json#/$defs/point"
        },
        "labelDx": {
          "type": "number"
        },
        "labelDy": {
          "type": "number"
        },
        "labelSegment": {
          "type": "integer",
          "minimum": 0
        },
        "width": {
          "$ref": "common.schema.json#/$defs/relationshipWidth"
        }
      }
    },
    "subarchitecture": {
      "type": "object",
      "additionalProperties": false,
      "required": [
        "title",
        "components"
      ],
      "properties": {
        "title": {
          "type": "string",
          "minLength": 1
        },
        "layout": {
          "$ref": "#/$defs/layout"
        },
        "components": {
          "type": "array",
          "minItems": 1,
          "maxItems": 12,
          "items": {
            "$ref": "#/$defs/localComponent"
          }
        },
        "boundaries": {
          "type": "array",
          "items": {
            "$ref": "#/$defs/boundary"
          }
        },
        "connections": {
          "type": "array",
          "items": {
            "$ref": "#/$defs/connection"
          }
        }
      }
    }
  },
  "type": "object",
  "additionalProperties": false,
  "required": [
    "schema_version",
    "diagram_type",
    "meta",
    "components"
  ],
  "properties": {
    "schema_version": {
      "const": 1
    },
    "diagram_type": {
      "const": "architecture"
    },
    "meta": {
      "type": "object",
      "additionalProperties": false,
      "required": [
        "title",
        "output"
      ],
      "properties": {
        "title": {
          "type": "string",
          "minLength": 1
        },
        "locale": {
          "$ref": "common.schema.json#/$defs/locale"
        },
        "translations": {
          "$ref": "common.schema.json#/$defs/translations"
        },
        "subtitle": {
          "type": "string"
        },
        "output": {
          "$ref": "common.schema.json#/$defs/portableOutputPath"
        },
        "animation": {
          "$ref": "common.schema.json#/$defs/animation"
        },
        "visual_preset": {
          "$ref": "common.schema.json#/$defs/visualPreset"
        },
        "quality_profile": {
          "$ref": "common.schema.json#/$defs/qualityProfile"
        },
        "engineering_profile": {
          "enum": [
            "deployment-ownership"
          ]
        },
        "repository": {
          "$ref": "common.schema.json#/$defs/repository"
        },
        "views": {
          "$ref": "common.schema.json#/$defs/guidedViews"
        },
        "legend": {
          "type": "object",
          "additionalProperties": false,
          "properties": {
            "mode": {
              "$ref": "common.schema.json#/$defs/legendMode"
            },
            "entries": {
              "type": "object",
              "additionalProperties": false,
              "properties": {
                "frontend": {
                  "$ref": "common.schema.json#/$defs/legendEntry"
                },
                "backend": {
                  "$ref": "common.schema.json#/$defs/legendEntry"
                },
                "database": {
                  "$ref": "common.schema.json#/$defs/legendEntry"
                },
                "cloud": {
                  "$ref": "common.schema.json#/$defs/legendEntry"
                },
                "security": {
                  "$ref": "common.schema.json#/$defs/legendEntry"
                },
                "messagebus": {
                  "$ref": "common.schema.json#/$defs/legendEntry"
                },
                "external": {
                  "$ref": "common.schema.json#/$defs/legendEntry"
                }
              }
            }
          }
        },
        "viewBox": {
          "type": "array",
          "prefixItems": [
            {
              "type": "number",
              "minimum": 320
            },
            {
              "type": "number",
              "minimum": 240
            }
          ],
          "items": false,
          "minItems": 2,
          "maxItems": 2
        }
      }
    },
    "layout": {
      "$ref": "#/$defs/layout"
    },
    "components": {
      "type": "array",
      "minItems": 1,
      "items": {
        "$ref": "#/$defs/topLevelComponent"
      }
    },
    "boundaries": {
      "type": "array",
      "items": {
        "$ref": "#/$defs/boundary"
      }
    },
    "connections": {
      "type": "array",
      "items": {
        "$ref": "#/$defs/connection"
      }
    },
    "cards": {
      "$ref": "common.schema.json#/$defs/cards"
    }
  }
}
